{
  "$schema": "http://json-schema.org/draft-07/schema#",
  "$id": "https://elt-engine.local/schema/deployment/v1.json",
  "title": "ELT Engine Deployment",
  "type": "object",
  "required": ["version", "mode", "database", "keycloak", "app"],
  "properties": {
    "version": { "type": "string", "const": "1" },
    "mode": { "type": "string", "enum": ["monolith", "distributed"] },
    "database": {
      "type": "object",
      "required": ["source", "user", "password", "elt_db_name", "keycloak_db_name"],
      "properties": {
        "source": { "type": "string", "enum": ["bundled", "external"] },
        "host": { "type": "string" },
        "port": { "type": "integer", "minimum": 1, "maximum": 65535, "default": 5432 },
        "user": { "type": "string" },
        "password": { "type": "string" },
        "elt_db_name": { "type": "string", "default": "elt_metadata" },
        "keycloak_db_name": { "type": "string", "default": "keycloak" }
      },
      "allOf": [
        {
          "if": { "properties": { "source": { "const": "external" } } },
          "then": { "required": ["host", "port"] }
        }
      ]
    },
    "monolith": {
      "type": "object",
      "properties": {
        "public_host": { "type": "string", "default": "localhost" },
        "use_proxy": { "type": "boolean", "default": true },
        "ports": {
          "type": "object",
          "properties": {
            "http": { "type": "integer", "default": 80 },
            "frontend": { "type": "integer", "default": 3000 },
            "api": { "type": "integer", "default": 8000 },
            "keycloak": { "type": "integer", "default": 8081 }
          }
        }
      }
    },
    "distributed": {
      "type": "object",
      "properties": {
        "services": {
          "type": "object",
          "additionalProperties": {
            "type": "object",
            "properties": {
              "host": { "type": "string" },
              "port": { "type": "integer" },
              "aws_instance_id": { "type": "string" }
            }
          }
        },
        "aws": {
          "type": "object",
          "properties": {
            "region": { "type": "string" },
            "role_arn": { "type": "string" },
            "external_id": { "type": "string" },
            "provisioning": { "type": "string", "enum": ["existing", "new"] }
          }
        }
      }
    },
    "keycloak": {
      "type": "object",
      "required": ["admin_user", "admin_password", "realm"],
      "properties": {
        "admin_user": { "type": "string" },
        "admin_password": { "type": "string" },
        "realm": { "type": "string", "default": "etl-dev" },
        "admin_client_id": { "type": "string", "default": "admin-cli" },
        "admin_client_secret": { "type": "string", "default": "" }
      }
    },
    "app": {
      "type": "object",
      "properties": {
        "name": { "type": "string", "default": "ELT Engine" },
        "image_tag": { "type": "string", "default": "v1.0.0" },
        "sandbox_enabled": { "type": "boolean", "default": true }
      }
    }
  },
  "allOf": [
    {
      "if": { "properties": { "mode": { "const": "monolith" } } },
      "then": { "required": ["monolith"] }
    },
    {
      "if": { "properties": { "mode": { "const": "distributed" } } },
      "then": { "required": ["distributed"] }
    }
  ]
}
